Actors,Awards,Country,Director,Genre,Language,Metascore,Plot,Poster,Rated,Released,Response,Runtime,Title,Type,Writer,Year,imdbID,imdbRating,imdbVotes
"Tim Robbins, Morgan Freeman, Bob Gunton, William Sadler",Nominated for 7 Oscars. Another 18 wins & 30 nominations.,USA,Frank Darabont,"Crime, Drama",English,80,"Two imprisoned men bond over a number of years, finding solace and eventual redemption through acts of common decency.",https://images-na.ssl-images-amazon.com/images/M/MV5BODU4MjU4NjIwNl5BMl5BanBnXkFtZTgwMDU2MjEyMDE@._V1_SX300.jpg,R,14 Oct 1994,True,142 min,The Shawshank Redemption,movie,"Stephen King (short story ""Rita Hayworth and Shawshank Redemption""), Frank Darabont (screenplay)",1994,tt0111161,9.3,"1,711,064"
"Marlon Brando, Al Pacino, James Caan, Richard S. Castellano",Won 3 Oscars. Another 23 wins & 27 nominations.,USA,Francis Ford Coppola,"Crime, Drama","English, Italian, Latin",100,The aging patriarch of an organized crime dynasty transfers control of his clandestine empire to his reluctant son.,https://images-na.ssl-images-amazon.com/images/M/MV5BNTUxOTdjMDMtMWY1MC00MjkxLTgxYTMtYTM1MjU5ZTJlNTZjXkEyXkFqcGdeQXVyNTA4NzY1MzY@._V1_SX300.jpg,R,24 Mar 1972,True,175 min,The Godfather,movie,"Mario Puzo (screenplay), Francis Ford Coppola (screenplay), Mario Puzo (novel)",1972,tt0068646,9.2,"1,177,812"
"Al Pacino, Robert Duvall, Diane Keaton, Robert De Niro",Won 6 Oscars. Another 10 wins & 20 nominations.,USA,Francis Ford Coppola,"Crime, Drama","English, Italian, Spanish, Latin, Sicilian",80,"The early life and career of Vito Corleone in 1920s New York is portrayed while his son, Michael, expands and tightens his grip on his crime syndicate stretching from Lake Tahoe, Nevada to pre-revolution 1958 Cuba.",https://images-na.ssl-images-amazon.com/images/M/MV5BOTE1MTBiYzYtMDI1OC00ZTUxLTg0ZWQtZjdjMzA0OTM1NGMwXkEyXkFqcGdeQXVyMjUzOTY1NTc@._V1_SX300.jpg,R,20 Dec 1974,True,202 min,The Godfather: Part II,movie,"Francis Ford Coppola (screenplay), Mario Puzo (screenplay), Mario Puzo (novel)",1974,tt0071562,9.0,"807,734"
"Christian Bale, Heath Ledger, Aaron Eckhart, Michael Caine",Won 2 Oscars. Another 146 wins & 142 nominations.,"USA, UK",Christopher Nolan,"Action, Crime, Drama","English, Mandarin",82,"When the menace known as the Joker wreaks havoc and chaos on the people of Gotham, the caped crusader must come to terms with one of the greatest psychological tests of his ability to fight injustice.",https://images-na.ssl-images-amazon.com/images/M/MV5BMTMxNTMwODM0NF5BMl5BanBnXkFtZTcwODAyMTk2Mw@@._V1_SX300.jpg,PG-13,18 Jul 2008,True,152 min,The Dark Knight,movie,"Jonathan Nolan (screenplay), Christopher Nolan (screenplay), Christopher Nolan (story), David S. Goyer (story), Bob Kane (characters)",2008,tt0468569,9.0,"1,699,835"
"Martin Balsam, John Fiedler, Lee J. Cobb, E.G. Marshall",Nominated for 3 Oscars. Another 16 wins & 8 nominations.,USA,Sidney Lumet,"Crime, Drama",English,N/A,A jury holdout attempts to prevent a miscarriage of justice by forcing his colleagues to reconsider the evidence.,https://images-na.ssl-images-amazon.com/images/M/MV5BODQwOTc5MDM2N15BMl5BanBnXkFtZTcwODQxNTEzNA@@._V1_SX300.jpg,APPROVED,01 Apr 1957,True,96 min,12 Angry Men,movie,"Reginald Rose (story), Reginald Rose (screenplay)",1957,tt0050083,8.9,"455,987"
"Liam Neeson, Ben Kingsley, Ralph Fiennes, Caroline Goodall",Won 7 Oscars. Another 71 wins & 33 nominations.,USA,Steven Spielberg,"Biography, Drama, History","English, Hebrew, German, Polish",93,"In German-occupied Poland during World War II, Oskar Schindler gradually becomes concerned for his Jewish workforce after witnessing their persecution by the Nazi Germans.",https://images-na.ssl-images-amazon.com/images/M/MV5BMzMwMTM4MDU2N15BMl5BanBnXkFtZTgwMzQ0MjMxMDE@._V1_SX300.jpg,R,04 Feb 1994,True,195 min,Schindler's List,movie,"Thomas Keneally (book), Steven Zaillian (screenplay)",1993,tt0108052,8.9,"877,500"
"Tim Roth, Amanda Plummer, Laura Lovelace, John Travolta",Won 1 Oscar. Another 60 wins & 65 nominations.,USA,Quentin Tarantino,"Crime, Drama","English, Spanish, French",94,"The lives of two mob hit men, a boxer, a gangster's wife, and a pair of diner bandits intertwine in four tales of violence and redemption.",https://images-na.ssl-images-amazon.com/images/M/MV5BMTkxMTA5OTAzMl5BMl5BanBnXkFtZTgwNjA5MDc3NjE@._V1_SX300.jpg,R,14 Oct 1994,True,154 min,Pulp Fiction,movie,"Quentin Tarantino (story), Roger Avary (story), Quentin Tarantino",1994,tt0110912,8.9,"1,343,852"
"Noel Appleby, Ali Astin, Sean Astin, David Aston",Won 11 Oscars. Another 174 wins & 113 nominations.,"USA, New Zealand",Peter Jackson,"Adventure, Drama, Fantasy","English, Quenya, Old English, Sindarin",94,Gandalf and Aragorn lead the World of Men against Sauron's army to draw his gaze from Frodo and Sam as they approach Mount Doom with the One Ring.,https://images-na.ssl-images-amazon.com/images/M/MV5BMjE4MjA1NTAyMV5BMl5BanBnXkFtZTcwNzM1NDQyMQ@@._V1_SX300.jpg,PG-13,17 Dec 2003,True,201 min,The Lord of the Rings: The Return of the King,movie,"J.R.R. Tolkien (novel), Fran Walsh (screenplay), Philippa Boyens (screenplay), Peter Jackson (screenplay)",2003,tt0167260,8.9,"1,238,528"
"Eli Wallach, Clint Eastwood, Lee Van Cleef, Aldo Giuffrè",1 win & 1 nomination.,"Italy, Spain, West Germany, USA",Sergio Leone,Western,Italian,90,A bounty hunting scam joins two men in an uneasy alliance against a third in a race to find a fortune in gold buried in a remote cemetery.,https://images-na.ssl-images-amazon.com/images/M/MV5BOTQ5NDI3MTI4MF5BMl5BanBnXkFtZTgwNDQ4ODE5MDE@._V1_SX300.jpg,APPROVED,29 Dec 1967,True,161 min,"The Good, the Bad and the Ugly",movie,"Luciano Vincenzoni (story), Sergio Leone (story), Agenore Incrocci (screenplay), Furio Scarpelli (screenplay), Luciano Vincenzoni (screenplay), Sergio Leone (screenplay), Mickey Knox (English version by)",1966,tt0060196,8.9,"510,591"
"Edward Norton, Brad Pitt, Meat Loaf, Zach Grenier",Nominated for 1 Oscar. Another 10 wins & 31 nominations.,"USA, Germany",David Fincher,Drama,English,66,"An insomniac office worker, looking for a way to change his life, crosses paths with a devil-may-care soap maker, forming an underground fight club that evolves into something much, much more.",https://images-na.ssl-images-amazon.com/images/M/MV5BNGM2NjQxZTAtMmU5My00YTk5LWFmOWMtYjZlYzk4YzMwNjFlXkEyXkFqcGdeQXVyNDk3NzU2MTQ@._V1_SX300.jpg,R,15 Oct 1999,True,139 min,Fight Club,movie,"Chuck Palahniuk (novel), Jim Uhls (screenplay)",1999,tt0137523,8.8,"1,373,233"
"Alan Howard, Noel Appleby, Sean Astin, Sala Baker",Won 4 Oscars. Another 108 wins & 122 nominations.,"New Zealand, USA",Peter Jackson,"Adventure, Drama, Fantasy","English, Sindarin",92,A meek Hobbit from the Shire and eight companions set out on a journey to destroy the powerful One Ring and save Middle Earth from the Dark Lord Sauron.,https://images-na.ssl-images-amazon.com/images/M/MV5BNTEyMjAwMDU1OV5BMl5BanBnXkFtZTcwNDQyNTkxMw@@._V1_SX300.jpg,PG-13,19 Dec 2001,True,178 min,The Lord of the Rings: The Fellowship of the Ring,movie,"J.R.R. Tolkien (novel), Fran Walsh (screenplay), Philippa Boyens (screenplay), Peter Jackson (screenplay)",2001,tt0120737,8.8,"1,261,067"
"Mark Hamill, Harrison Ford, Carrie Fisher, Billy Dee Williams",Won 1 Oscar. Another 19 wins & 18 nominations.,USA,Irvin Kershner,"Action, Adventure, Fantasy",English,80,"After the rebels have been brutally overpowered by the Empire on their newly established base, Luke Skywalker takes advanced Jedi training with Master Yoda, while his friends are pursued by Darth Vader as part of his plan to capture Luke.",https://images-na.ssl-images-amazon.com/images/M/MV5BYmViY2M2MTYtY2MzOS00YjQ1LWIzYmEtOTBiNjhlMGM0NjZjXkEyXkFqcGdeQXVyNDYyMDk5MTU@._V1_SX300.jpg,PG,20 Jun 1980,True,124 min,Star Wars: Episode V - The Empire Strikes Back,movie,"Leigh Brackett (screenplay), Lawrence Kasdan (screenplay), George Lucas (story by)",1980,tt0080684,8.8,"855,007"
"Tom Hanks, Rebecca Williams, Sally Field, Michael Conner Humphreys",Won 6 Oscars. Another 39 wins & 65 nominations.,USA,Robert Zemeckis,"Comedy, Drama",English,82,"Forrest Gump, while not intelligent, has accidentally been present at many historic moments, but his true love, Jenny Curran, eludes him.",https://images-na.ssl-images-amazon.com/images/M/MV5BYThjM2MwZGMtMzg3Ny00NGRkLWE4M2EtYTBiNWMzOTY0YTI4XkEyXkFqcGdeQXVyNDYyMDk5MTU@._V1_SX300.jpg,PG-13,06 Jul 1994,True,142 min,Forrest Gump,movie,"Winston Groom (novel), Eric Roth (screenplay)",1994,tt0109830,8.8,"1,279,349"
"Leonardo DiCaprio, Joseph Gordon-Levitt, Ellen Page, Tom Hardy",Won 4 Oscars. Another 143 wins & 198 nominations.,"USA, UK",Christopher Nolan,"Action, Adventure, Sci-Fi","English, Japanese, French",74,"A thief, who steals corporate secrets through use of dream-sharing technology, is given the inverse task of planting an idea into the mind of a CEO.",https://images-na.ssl-images-amazon.com/images/M/MV5BMjAxMzY3NjcxNF5BMl5BanBnXkFtZTcwNTI5OTM0Mw@@._V1_SX300.jpg,PG-13,16 Jul 2010,True,148 min,Inception,movie,Christopher Nolan,2010,tt1375666,8.8,"1,489,067"
"Bruce Allpress, Sean Astin, John Bach, Sala Baker",Won 2 Oscars. Another 114 wins & 127 nominations.,"USA, New Zealand",Peter Jackson,"Adventure, Drama, Fantasy","English, Sindarin, Old English",88,"While Frodo and Sam edge closer to Mordor with the help of the shifty Gollum, the divided fellowship makes a stand against Sauron's new ally, Saruman, and his hordes of Isengard.",https://images-na.ssl-images-amazon.com/images/M/MV5BMTAyNDU0NjY4NTheQTJeQWpwZ15BbWU2MDk4MTY2Nw@@._V1_SX300.jpg,PG-13,18 Dec 2002,True,179 min,The Lord of the Rings: The Two Towers,movie,"J.R.R. Tolkien (novel), Fran Walsh (screenplay), Philippa Boyens (screenplay), Stephen Sinclair (screenplay), Peter Jackson (screenplay)",2002,tt0167261,8.7,"1,120,701"
"Michael Berryman, Peter Brocco, Dean R. Brooks, Alonzo Brown",Won 5 Oscars. Another 30 wins & 13 nominations.,USA,Milos Forman,Drama,English,79,A criminal pleads insanity after getting into trouble again and once in the mental institution rebels against the oppressive nurse and rallies up the scared patients.,https://images-na.ssl-images-amazon.com/images/M/MV5BYmJkODkwOTItZThjZC00MTE0LWIxNzQtYTM3MmQwMGI1OWFiXkEyXkFqcGdeQXVyNjUwNzk3NDc@._V1_SX300.jpg,R,21 Nov 1975,True,133 min,One Flew Over the Cuckoo's Nest,movie,"Lawrence Hauben (screenplay), Bo Goldman (screenplay), Ken Kesey (based on the novel by), Dale Wasserman (the play version: ""One Flew Over the Cuckoo's Nest"" by)",1975,tt0073486,8.7,"687,873"
"Robert De Niro, Ray Liotta, Joe Pesci, Lorraine Bracco",Won 1 Oscar. Another 37 wins & 32 nominations.,USA,Martin Scorsese,"Biography, Crime, Drama","English, Italian",89,Henry Hill and his friends work their way up through the mob hierarchy.,https://images-na.ssl-images-amazon.com/images/M/MV5BMTY2OTE5MzQ3MV5BMl5BanBnXkFtZTgwMTY2NTYxMTE@._V1_SX300.jpg,R,21 Sep 1990,True,146 min,Goodfellas,movie,"Nicholas Pileggi (book), Nicholas Pileggi (screenplay), Martin Scorsese (screenplay)",1990,tt0099685,8.7,"738,291"
"Keanu Reeves, Laurence Fishburne, Carrie-Anne Moss, Hugo Weaving",Won 4 Oscars. Another 33 wins & 43 nominations.,USA,"Lana Wachowski, Lilly Wachowski","Action, Sci-Fi",English,73,A computer hacker learns from mysterious rebels about the true nature of his reality and his role in the war against its controllers.,https://images-na.ssl-images-amazon.com/images/M/MV5BMDMyMmQ5YzgtYWMxOC00OTU0LWIwZjEtZWUwYTY5MjVkZjhhXkEyXkFqcGdeQXVyNDYyMDk5MTU@._V1_SX300.jpg,R,31 Mar 1999,True,136 min,The Matrix,movie,"Lilly Wachowski, Lana Wachowski",1999,tt0133093,8.7,"1,233,966"
"Toshirô Mifune, Takashi Shimura, Keiko Tsushima, Yukiko Shimazaki",Nominated for 2 Oscars. Another 5 wins & 6 nominations.,Japan,Akira Kurosawa,"Action, Adventure, Drama",Japanese,98,A poor village under attack by bandits recruits seven unemployed samurai to help them defend themselves.,https://images-na.ssl-images-amazon.com/images/M/MV5BMTc5MDY1MjU5MF5BMl5BanBnXkFtZTgwNDM2OTE4MzE@._V1_SX300.jpg,UNRATED,19 Nov 1956,True,207 min,Seven Samurai,movie,"Akira Kurosawa (screenplay), Shinobu Hashimoto (screenplay), Hideo Oguni (screenplay)",1954,tt0047478,8.7,"232,249"
"Mark Hamill, Harrison Ford, Carrie Fisher, Peter Cushing",Won 6 Oscars. Another 48 wins & 28 nominations.,USA,George Lucas,"Action, Adventure, Fantasy",English,92,"Luke Skywalker joins forces with a Jedi Knight, a cocky pilot, a wookiee and two droids to save the galaxy from the Empire's world-destroying battle-station, while also attempting to rescue Princess Leia from the evil Darth Vader.",https://images-na.ssl-images-amazon.com/images/M/MV5BZGEzZTExMDEtNjg4OC00NjQxLTk5NTUtNjRkNjA3MmYwZjg1XkEyXkFqcGdeQXVyMTQxNzMzNDI@._V1_SX300.jpg,PG,25 May 1977,True,121 min,Star Wars: Episode IV - A New Hope,movie,George Lucas,1977,tt0076759,8.7,"927,743"
"Alexandre Rodrigues, Leandro Firmino, Phellipe Haagensen, Douglas Silva",Nominated for 4 Oscars. Another 65 wins & 37 nominations.,"Brazil, France","Fernando Meirelles, Kátia Lund","Crime, Drama",Portuguese,79,"Two boys growing up in a violent neighborhood of Rio de Janeiro take different paths: one becomes a photographer, the other a drug dealer.",https://images-na.ssl-images-amazon.com/images/M/MV5BMjA4ODQ3ODkzNV5BMl5BanBnXkFtZTYwOTc4NDI3._V1_SX300.jpg,R,13 Feb 2004,True,130 min,City of God,movie,"Paulo Lins (novel), Bráulio Mantovani (screenplay)",2002,tt0317248,8.7,"540,033"
"Morgan Freeman, Andrew Kevin Walker, Daniel Zacapa, Brad Pitt",Nominated for 1 Oscar. Another 25 wins & 34 nominations.,USA,David Fincher,"Crime, Drama, Mystery",English,65,"Two detectives, a rookie and a veteran, hunt a serial killer who uses the seven deadly sins as his modus operandi.",https://images-na.ssl-images-amazon.com/images/M/MV5BMTQwNTU3MTE4NF5BMl5BanBnXkFtZTcwOTgxNDM2Mg@@._V1_SX300.jpg,R,22 Sep 1995,True,127 min,Se7en,movie,Andrew Kevin Walker,1995,tt0114369,8.6,"1,039,302"
"Jodie Foster, Lawrence A. Bonney, Kasi Lemmons, Lawrence T. Wrentz",Won 5 Oscars. Another 48 wins & 34 nominations.,USA,Jonathan Demme,"Crime, Drama, Thriller",English,84,A young F.B.I. cadet must confide in an incarcerated and manipulative killer to receive his help on catching another serial killer who skins his victims.,https://images-na.ssl-images-amazon.com/images/M/MV5BMTQ2NzkzMDI4OF5BMl5BanBnXkFtZTcwMDA0NzE1NA@@._V1_SX300.jpg,R,14 Feb 1991,True,118 min,The Silence of the Lambs,movie,"Thomas Harris (novel), Ted Tally (screenplay)",1991,tt0102926,8.6,"907,862"
"James Stewart, Donna Reed, Lionel Barrymore, Thomas Mitchell",Nominated for 5 Oscars. Another 6 wins & 1 nomination.,USA,Frank Capra,"Drama, Family, Fantasy",English,N/A,An angel helps a compassionate but despairingly frustrated businessman by showing what life would have been like if he never existed.,https://images-na.ssl-images-amazon.com/images/M/MV5BMTMzMzY5NDc4M15BMl5BanBnXkFtZTcwMzc4NjIxNw@@._V1_SX300.jpg,PG,07 Jan 1947,True,130 min,It's a Wonderful Life,movie,"Frances Goodrich (screenplay), Albert Hackett (screenplay), Frank Capra (screenplay), Jo Swerling (additional scenes), Philip Van Doren Stern (story)",1946,tt0038650,8.6,"279,316"
"Stephen Baldwin, Gabriel Byrne, Benicio Del Toro, Kevin Pollak",Won 2 Oscars. Another 32 wins & 16 nominations.,"USA, Germany",Bryan Singer,"Crime, Drama, Mystery","English, Hungarian, Spanish, French",77,"A sole survivor tells of the twisty events leading up to a horrific gun battle on a boat, which begin when five criminals meet at a seemingly random police lineup.",https://images-na.ssl-images-amazon.com/images/M/MV5BMzI1MjI5MDQyOV5BMl5BanBnXkFtZTcwNzE4Mjg3NA@@._V1_SX300.jpg,R,15 Sep 1995,True,106 min,The Usual Suspects,movie,Christopher McQuarrie,1995,tt0114814,8.6,"755,193"
"Roberto Benigni, Nicoletta Braschi, Giorgio Cantarini, Giustino Durano",Won 3 Oscars. Another 62 wins & 44 nominations.,Italy,Roberto Benigni,"Comedy, Drama, War","Italian, German, English",59,"When an open-minded Jewish librarian and his son become victims of the Holocaust, he uses a perfect mixture of will, humor and imagination to protect his son from the dangers around their camp.",http://ia.media-imdb.com/images/M/MV5BMTQwMTM2MjE4Ml5BMl5BanBnXkFtZTgwODQ2NTYxMTE@._V1_SX300.jpg,PG-13,12 Feb 1999,True,116 min,Life Is Beautiful,movie,"Vincenzo Cerami (story and screenplay by), Roberto Benigni (story and screenplay by)",1997,tt0118799,8.6,"424,251"
"Jean Reno, Gary Oldman, Natalie Portman, Danny Aiello",5 wins & 11 nominations.,France,Luc Besson,"Crime, Drama, Thriller","English, Italian, French",64,"Mathilda, a 12-year-old girl, is reluctantly taken in by Léon, a professional assassin, after her family is murdered. Léon and Mathilda form an unusual relationship, as she becomes his protégée and learns the assassin's trade.",https://images-na.ssl-images-amazon.com/images/M/MV5BMTgzMzg4MDkwNF5BMl5BanBnXkFtZTcwODAwNDg3OA@@._V1_SX300.jpg,R,18 Nov 1994,True,110 min,Léon: The Professional,movie,Luc Besson,1994,tt0110413,8.6,"736,782"
"Rumi Hiiragi, Miyu Irino, Mari Natsuki, Takashi Naitô",Won 1 Oscar. Another 53 wins & 24 nominations.,Japan,Hayao Miyazaki,"Animation, Adventure, Family",Japanese,94,"During her family's move to the suburbs, a sullen 10-year-old girl wanders into a world ruled by gods, witches, and spirits, and where humans are changed into beasts.",https://images-na.ssl-images-amazon.com/images/M/MV5BMjYxMDcyMzIzNl5BMl5BanBnXkFtZTYwNDg2MDU3._V1_SX300.jpg,PG,28 Mar 2003,True,125 min,Spirited Away,movie,Hayao Miyazaki,2001,tt0245429,8.6,"429,019"
"Tom Hanks, Tom Sizemore, Edward Burns, Barry Pepper",Won 5 Oscars. Another 74 wins & 74 nominations.,USA,Steven Spielberg,"Action, Drama, War","English, French, German, Czech",90,"Following the Normandy Landings, a group of U.S. soldiers go behind enemy lines to retrieve a paratrooper whose brothers have been killed in action.",https://images-na.ssl-images-amazon.com/images/M/MV5BZjhkMDM4MWItZTVjOC00ZDRhLThmYTAtM2I5NzBmNmNlMzI1XkEyXkFqcGdeQXVyNDYyMDk5MTU@._V1_SX300.jpg,R,24 Jul 1998,True,169 min,Saving Private Ryan,movie,Robert Rodat,1998,tt0120815,8.6,"897,416"
"Claudia Cardinale, Henry Fonda, Jason Robards, Charles Bronson",4 wins & 5 nominations.,"Italy, USA",Sergio Leone,Western,"Italian, Spanish",80,A mysterious stranger with a harmonica joins forces with a notorious desperado to protect a beautiful widow from a ruthless assassin working for the railroad.,https://images-na.ssl-images-amazon.com/images/M/MV5BYjFiOTlmMzgtOGZlYi00NjY0LThmMzEtNmQ0OTgxNGViOTZmXkEyXkFqcGdeQXVyNjc1NTYyMjg@._V1_SX300.jpg,PG-13,04 Jul 1969,True,175 min,Once Upon a Time in the West,movie,"Sergio Donati (screenplay), Sergio Leone (screenplay), Dario Argento (from a story by), Bernardo Bertolucci (from a story by), Sergio Leone (from a story by)",1968,tt0064116,8.6,"219,086"
"Edward Norton, Edward Furlong, Beverly D'Angelo, Jennifer Lien",Nominated for 1 Oscar. Another 4 wins & 13 nominations.,USA,Tony Kaye,"Crime, Drama",English,62,A former neo-nazi skinhead tries to prevent his younger brother from going down the same wrong path that he did.,https://images-na.ssl-images-amazon.com/images/M/MV5BZjA0MTM4MTQtNzY5MC00NzY3LWI1ZTgtYzcxMjkyMzU4MDZiXkEyXkFqcGdeQXVyNDYyMDk5MTU@._V1_SX300.jpg,R,20 Nov 1998,True,119 min,American History X,movie,David McKenna,1998,tt0120586,8.6,"793,756"
"Ellen Burstyn, Matthew McConaughey, Mackenzie Foy, John Lithgow",Won 1 Oscar. Another 39 wins & 134 nominations.,"USA, UK",Christopher Nolan,"Adventure, Drama, Sci-Fi",English,74,A team of explorers travel through a wormhole in space in an attempt to ensure humanity's survival.,https://images-na.ssl-images-amazon.com/images/M/MV5BMjIxNTU4MzY4MF5BMl5BanBnXkFtZTgwMzM4ODI3MjE@._V1_SX300.jpg,PG-13,07 Nov 2014,True,169 min,Interstellar,movie,"Jonathan Nolan, Christopher Nolan",2014,tt0816692,8.6,"961,788"
"Humphrey Bogart, Ingrid Bergman, Paul Henreid, Claude Rains",Won 3 Oscars. Another 4 wins & 8 nominations.,USA,Michael Curtiz,"Drama, Romance, War","English, French, German, Italian",N/A,"In Casablanca, Morocco in December 1941, a cynical American expatriate meets a former lover, with unforeseen complications.",https://images-na.ssl-images-amazon.com/images/M/MV5BMjQwNDYyNTk2N15BMl5BanBnXkFtZTgwMjQ0OTMyMjE@._V1_SX300.jpg,PG,23 Jan 1943,True,102 min,Casablanca,movie,"Julius J. Epstein (screenplay), Philip G. Epstein (screenplay), Howard Koch (screenplay), Murray Burnett (play), Joan Alison (play)",1942,tt0034583,8.6,"392,074"
"Anthony Perkins, Vera Miles, John Gavin, Janet Leigh",Nominated for 4 Oscars. Another 5 wins & 9 nominations.,USA,Alfred Hitchcock,"Horror, Mystery, Thriller",English,N/A,"A Phoenix secretary embezzles $40,000 from her employer's client, goes on the run, and checks into a remote motel run by a young man under the domination of his mother.",https://images-na.ssl-images-amazon.com/images/M/MV5BMDI3OWRmOTEtOWJhYi00N2JkLTgwNGItMjdkN2U0NjFiZTYwXkEyXkFqcGdeQXVyMTQxNzMzNDI@._V1_SX300.jpg,R,08 Sep 1960,True,109 min,Psycho,movie,"Joseph Stefano (screenplay), Robert Bloch (novel)",1960,tt0054215,8.5,"428,898"
"Virginia Cherrill, Florence Lee, Harry Myers, Al Ernest Garcia",3 wins.,USA,Charles Chaplin,"Comedy, Drama, Romance",English,N/A,"With the aid of a wealthy erratic tippler, a dewy-eyed tramp who has fallen in love with a sightless flower girl accumulates money to be able to help her medically.",https://images-na.ssl-images-amazon.com/images/M/MV5BMjA3NDQ5MDMzOV5BMl5BanBnXkFtZTgwODY2MjcyMjE@._V1_SX300.jpg,PASSED,07 Mar 1931,True,87 min,City Lights,movie,Charles Chaplin,1931,tt0021749,8.6,"111,118"
"Harrison Ford, Karen Allen, Paul Freeman, Ronald Lacey",Won 4 Oscars. Another 30 wins & 23 nominations.,USA,Steven Spielberg,"Action, Adventure","English, German, Hebrew, Spanish, Arabic, Nepali",85,Archaeologist and adventurer Indiana Jones is hired by the U.S. government to find the Ark of the Covenant before the Nazis.,https://images-na.ssl-images-amazon.com/images/M/MV5BMjA0ODEzMTc1Nl5BMl5BanBnXkFtZTcwODM2MjAxNA@@._V1_SX300.jpg,PG,12 Jun 1981,True,115 min,Raiders of the Lost Ark,movie,"Lawrence Kasdan (screenplay), George Lucas (story by), Philip Kaufman (story by)",1981,tt0082971,8.5,"671,034"
"Tom Hanks, David Morse, Michael Clarke Duncan, Bonnie Hunt",Nominated for 4 Oscars. Another 15 wins & 30 nominations.,USA,Frank Darabont,"Crime, Drama, Fantasy","English, French",61,"The lives of guards on Death Row are affected by one of their charges: a black man accused of child murder and rape, yet who has a mysterious gift.",https://images-na.ssl-images-amazon.com/images/M/MV5BMTUxMzQyNjA5MF5BMl5BanBnXkFtZTYwOTU2NTY3._V1_SX300.jpg,R,10 Dec 1999,True,189 min,The Green Mile,movie,"Stephen King (novel), Frank Darabont (screenplay)",1999,tt0120689,8.5,"796,160"
"François Cluzet, Omar Sy, Anne Le Ny, Audrey Fleurot",Nominated for 1 Golden Globe. Another 33 wins & 39 nominations.,France,"Olivier Nakache, Eric Toledano","Biography, Comedy, Drama","French, English",57,"After he becomes a quadriplegic from a paragliding accident, an aristocrat hires a young man from the projects to be his caregiver.",https://images-na.ssl-images-amazon.com/images/M/MV5BMTYxNDA3MDQwNl5BMl5BanBnXkFtZTcwNTU4Mzc1Nw@@._V1_SX300.jpg,R,02 Nov 2011,True,112 min,The Intouchables,movie,"Olivier Nakache, Eric Toledano",2011,tt1675434,8.6,"517,195"
"Charles Chaplin, Paulette Goddard, Henry Bergman, Tiny Sandford",4 wins & 1 nomination.,USA,Charles Chaplin,"Comedy, Drama, Family",English,96,The Tramp struggles to live in modern industrial society with the help of a young homeless woman.,https://images-na.ssl-images-amazon.com/images/M/MV5BMjAyMTkxNjI5OF5BMl5BanBnXkFtZTYwMjI2MjA5._V1_SX300.jpg,G,25 Feb 1936,True,87 min,Modern Times,movie,Charles Chaplin,1936,tt0027977,8.6,"147,025"
"James Stewart, Grace Kelly, Wendell Corey, Thelma Ritter",Nominated for 4 Oscars. Another 6 wins & 8 nominations.,USA,Alfred Hitchcock,"Mystery, Thriller",English,N/A,A wheelchair-bound photographer spies on his neighbours from his apartment window and becomes convinced one of them has committed murder.,https://images-na.ssl-images-amazon.com/images/M/MV5BNGUxYWM3M2MtMGM3Mi00ZmRiLWE0NGQtZjE5ODI2OTJhNTU0XkEyXkFqcGdeQXVyMTQxNzMzNDI@._V1_SX300.jpg,APPROVED,01 Sep 1954,True,112 min,Rear Window,movie,"John Michael Hayes (screenplay), Cornell Woolrich (based on the short story by)",1954,tt0047396,8.5,"320,750"
"Arnold Schwarzenegger, Linda Hamilton, Edward Furlong, Robert Patrick",Won 4 Oscars. Another 21 wins & 22 nominations.,"USA, France",James Cameron,"Action, Sci-Fi, Thriller","English, Spanish",75,"A cyborg, identical to the one who failed to kill Sarah Connor, must now protect her young son, John Connor, from a more advanced cyborg, made out of liquid metal.",https://images-na.ssl-images-amazon.com/images/M/MV5BZDM2YjYwYWMtMWZlNi00ZDQxLWExMDctMDAzNzQ0OTkzZjljXkEyXkFqcGdeQXVyMTQxNzMzNDI@._V1_SX300.jpg,R,03 Jul 1991,True,137 min,Terminator 2: Judgment Day,movie,"James Cameron, William Wisher Jr.",1991,tt0103064,8.5,"754,399"
"Leonardo DiCaprio, Matt Damon, Jack Nicholson, Mark Wahlberg",Won 4 Oscars. Another 90 wins & 123 nominations.,"USA, Hong Kong",Martin Scorsese,"Crime, Drama, Thriller","English, Cantonese",86,An undercover cop and a mole in the police attempt to identify each other while infiltrating an Irish gang in South Boston.,https://images-na.ssl-images-amazon.com/images/M/MV5BMTI1MTY2OTIxNV5BMl5BanBnXkFtZTYwNjQ4NjY3._V1_SX300.jpg,R,06 Oct 2006,True,151 min,The Departed,movie,"William Monahan (screenplay), Alan Mak, Felix Chong",2006,tt0407887,8.5,"885,411"
